{
  "@context": {
    "@vocab": "https://schema-resume.org/",
    "schema": "http://schema.org/",
    "xsd": "http://www.w3.org/2001/XMLSchema#",
    "name": "schema:name",
    "email": "schema:email",
    "url": "schema:url",
    "telephone": "schema:telephone",
    "address": "schema:address",
    "jobTitle": "schema:jobTitle",
    "worksFor": "schema:worksFor",
    "alumniOf": "schema:alumniOf",
    "award": "schema:award",
    "knowsAbout": "schema:knowsAbout",
    "knowsLanguage": "schema:knowsLanguage"
  },
  "$schema": "https://schema-resume.org/meta-schema.json",
  "$id": "https://schema-resume.org/schema.json",
  "$comment": "Primary domain: https://schema-resume.org/ | Alternate domain: https://tradik.github.io/schema-resume/",
  "additionalProperties": true,
  "definitions": {
    "iso8601": {
      "type": "string",
      "description": "Date in ISO 8601 format with flexible precision - full date (2024-03-15), year-month (2024-03), or year only (2024)",
      "pattern": "^([1-2][0-9]{3}-[0-1][0-9]-[0-3][0-9]|[1-2][0-9]{3}-[0-1][0-9]|[1-2][0-9]{3})$"
    }
  },
  "properties": {
    "$schema": {
      "type": "string",
      "description": "link to the version of the schema that can validate the resume",
      "format": "uri"
    },
    "@type": {
      "type": "string",
      "description": "JSON-LD type for the document, typically 'DigitalDocument' for Schema.org compatibility"
    },
    "additionalType": {
      "type": "string",
      "description": "Additional type information for the document, can be a URL or Schema.org type",
      "format": "uri"
    },
    "basics": {
      "type": "object",
      "additionalProperties": true,
      "properties": {
        "name": {
          "type": "string",
          "description": "Full name of the person"
        },
        "label": {
          "type": "string",
          "description": "Professional title or role, such as 'Senior Software Engineer' or 'Product Designer'"
        },
        "title": {
          "type": "string",
          "description": "Job title or professional title of the person"
        },
        "age": {
          "type": "integer",
          "description": "Age of the person in years",
          "minimum": 0
        },
        "dateOfBirth": {
          "$ref": "#/definitions/iso8601",
          "description": "Date of birth in ISO 8601 format"
        },
        "gender": {
          "type": "string",
          "description": "Gender identity of the person"
        },
        "legalNote": {
          "type": "object",
          "description": "Legal disclaimers, consent statements, or data processing notes with optional country-specific context",
          "additionalProperties": true,
          "properties": {
            "text": {
              "type": "string",
              "description": "The legal note or disclaimer text"
            },
            "country": {
              "type": "string",
              "description": "Country code (ISO-3166-1 ALPHA-2) if the legal note is country-specific"
            },
            "type": {
              "type": "string",
              "description": "Type of legal note (e.g., 'gdpr_consent', 'data_processing', 'disclaimer')"
            },
            "url": {
              "type": "string",
              "description": "URL to full legal text or privacy policy",
              "format": "uri"
            }
          }
        },
        "image": {
          "type": "string",
          "description": "Web address pointing to a profile photograph in JPEG or PNG format"
        },
        "email": {
          "type": "string",
          "description": "Primary email address for professional contact",
          "format": "email"
        },
        "phone": {
          "type": "string",
          "description": "Contact telephone number in any preferred format"
        },
        "url": {
          "type": "string",
          "description": "Personal website or portfolio URL",
          "format": "uri"
        },
        "summary": {
          "type": "string",
          "description": "Brief professional summary highlighting key experience and expertise"
        },
        "keyAchievements": {
          "type": "array",
          "description": "Notable career achievements and accomplishments",
          "additionalItems": false,
          "items": {
            "type": "string",
            "description": "Individual achievement"
          }
        },
        "coreCompetencies": {
          "type": "array",
          "description": "Core professional competencies and areas of expertise",
          "additionalItems": false,
          "items": {
            "type": "string",
            "description": "Competency or area of expertise"
          }
        },
        "location": {
          "type": "object",
          "additionalProperties": true,
          "properties": {
            "address": {
              "type": "string",
              "description": "Street address with multiple lines separated by newline characters (\\n)"
            },
            "streetAddress": {
              "type": "string",
              "description": "Street address line"
            },
            "postalCode": {
              "type": "string",
              "description": "Postal or ZIP code"
            },
            "city": {
              "type": "string",
              "description": "City or town name"
            },
            "countryCode": {
              "type": "string",
              "description": "Two-letter country code following ISO-3166-1 ALPHA-2 standard (GB, US, FR, etc.)"
            },
            "region": {
              "type": "string",
              "description": "State, county, province, or region within the country"
            }
          }
        },
        "profiles": {
          "type": "array",
          "description": "List of social media and professional network profiles",
          "additionalItems": false,
          "items": {
            "type": "object",
            "additionalProperties": true,
            "properties": {
              "network": {
                "type": "string",
                "description": "Name of the social network or platform (LinkedIn, GitHub, Twitter, etc.)"
              },
              "username": {
                "type": "string",
                "description": "Username or handle on the platform"
              },
              "url": {
                "type": "string",
                "description": "Direct link to the profile page",
                "format": "uri"
              }
            }
          }
        },
        "nationalities": {
          "type": "array",
          "description": "Citizenship and nationality information",
          "additionalItems": false,
          "items": {
            "type": "object",
            "additionalProperties": true,
            "properties": {
              "@type": {
                "type": "string",
                "description": "Schema.org type, should be 'schema:Country' for validator.schema.org compatibility"
              },
              "country": {
                "type": "string",
                "description": "Country of citizenship using ISO-3166-1 ALPHA-2 code (GB, US, FR, etc.)"
              },
              "born": {
                "type": "boolean",
                "description": "Whether this is the country of birth"
              }
            }
          }
        },
        "workAuthorization": {
          "type": "array",
          "description": "Work authorization information for multiple countries",
          "additionalItems": false,
          "items": {
            "type": "object",
            "additionalProperties": true,
            "properties": {
              "country": {
                "type": "string",
                "description": "Country code using ISO-3166-1 ALPHA-2 standard (e.g., GB, US, FR)"
              },
              "status": {
                "type": "string",
                "description": "Work authorization status (e.g., 'Citizen', 'Permanent Resident', 'Work Visa', 'No Authorization')"
              },
              "rightToWork": {
                "type": "boolean",
                "description": "Whether person has unrestricted right to work in this country"
              },
              "visaType": {
                "type": "string",
                "description": "Type or category of visa if applicable (e.g., 'H-1B', 'Skilled Worker', 'Temporary', 'Permanent Residence')"
              },
              "validFrom": {
                "$ref": "#/definitions/iso8601",
                "description": "Start date of work authorization or visa validity"
              },
              "validTo": {
                "$ref": "#/definitions/iso8601",
                "description": "Expiration date of work authorization or visa (omit if permanent)"
              },
              "notes": {
                "type": "string",
                "description": "Additional notes or restrictions on work authorization"
              }
            },
            "required": ["country"]
          }
        }
      }
    },
    "work": {
      "type": "array",
      "description": "Employment history including current and previous positions",
      "additionalItems": false,
      "items": {
        "type": "object",
        "additionalProperties": true,
        "properties": {
          "@type": {
            "type": "string",
            "description": "Schema.org type, should be 'schema:Organization' for validator.schema.org compatibility"
          },
          "name": {
            "type": "string",
            "description": "Company or organization name"
          },
          "industry": {
            "type": "string",
            "description": "Industry sector or business domain of the organization (e.g., 'Financial Technology', 'Healthcare', 'E-commerce', 'Manufacturing')"
          },
          "location": {